Theme Configuration,Theme Configuration
Designer Tool Theme,Designer Tool Theme
Select the theme of the designer tool,Select the theme of the designer tool
Designer Tool Primary Color,Designer Tool Primary Colour
Primary Color is set for all other related colors of the tool. Do not use very light color otherwise text content will not be visible.,Primary Colour is set four all other related colours of the tool. Do not use very light colour otherwise text content will not be visible.
Click on Save Button to Save Theme,Click on Save Button to Save Theme
Dark Theme Logo,Dark Theme Logo
Add logo that will be displayed for dark theme.,Add logo that will be displayed four dark theme.
